{
  "title": "FIXTURE: no results - no majority - images",
  "sources": [
    {
      "text": "NZZ",
      "link": {
        "url": "https://nzz.ch",
        "isValid": true
      }
    }
  ],
  "subtitle":
    "Möglichkeit zusätzliche Informationen als Untertitel zu erfassen",
  "notes":
    "Jemand musste Josef K. verleumdet haben, denn ohne dass er etwas Böses getan hätte, wurde er eines 'Morgens verhaftet.",
  "candidates": [
    {
      "name": "Hans Wurst",
      "color": {
        "full": {}
      },
      "picture": {
        "key": "2018/02/09/7d6fb4e4-e4a8-4e18-bb8f-36849ac9681c.png",
        "url":
          "https://nzz-q-assets-stage.s3.eu-west-1.amazonaws.com/2018/02/09/7d6fb4e4-e4a8-4e18-bb8f-36849ac9681c.png",
        "length": 5239,
        "width": 88,
        "height": 88
      },
      "isPrevious": true
    },
    {
      "name": "Maria Müller",
      "party": "SPD",
      "color": {
        "full": {}
      },
      "picture": {
        "key": "2018/02/09/3928b174-f2b3-4f45-b3f9-29d7aede0a06.png",
        "url":
          "https://nzz-q-assets-stage.s3.eu-west-1.amazonaws.com/2018/02/09/3928b174-f2b3-4f45-b3f9-29d7aede0a06.png",
        "length": 4615,
        "width": 88,
        "height": 88
      },
      "isPrevious": false
    },
    {
      "name": "Abdalá Bucaram",
      "party": "Fuerza Compromiso Social Social",
      "color": {
        "full": {}
      },
      "picture": {
        "key": "2018/02/09/2ea4a01c-0a28-4a4f-a643-3bd95a88a076.png",
        "url":
          "https://nzz-q-assets-stage.s3.eu-west-1.amazonaws.com/2018/02/09/2ea4a01c-0a28-4a4f-a643-3bd95a88a076.png",
        "length": 4615,
        "width": 88,
        "height": 88
      },
      "isPrevious": false
    },
    {
      "name": "Susann Salami",
      "party": "Die Linke",
      "color": {
        "full": {},
        "light": {}
      },
      "picture": {
        "key": "2018/02/09/c693d199-6900-4769-ad6a-03af483fa023.png",
        "url":
          "https://nzz-q-assets-stage.s3.eu-west-1.amazonaws.com/2018/02/09/c693d199-6900-4769-ad6a-03af483fa023.png",
        "length": 5239,
        "width": 88,
        "height": 88
      },
      "isPrevious": true
    }
  ]
}
