{
  "title": "FIXTURE: results - majority - statuses - no images",
  "sources": [
    {
      "text": "NZZ",
      "link": {
        "url": "https://nzz.ch",
        "isValid": true
      }
    }
  ],
  "subtitle": "Möglichkeit zusätzliche Informationen als Untertitel zu erfassen",
  "notes": "Jemand musste Josef K. verleumdet haben, denn ohne dass er etwas Böses getan hätte, wurde er eines 'Morgens verhaftet.",
  "majority": 5000,
  "candidates": [
    {
      "name": "Hans Wurst",
      "color": {},
      "isPrevious": true,
      "status": "not elected",
      "votes": 50000
    },
    {
      "name": "Maria Müller",
      "party": "SPD",
      "color": {},
      "isPrevious": false,
      "status": "elected",
      "votes": 120000
    },
    {
      "name": "Abdalá Bucaram",
      "party": "Fuerza Compromiso Social Social Fuerza Compromiso Social Social",
      "color": {},
      "isPrevious": false,
      "status": "not elected",
      "votes": 90000
    },
    {
      "name": "Susann Anderegg",
      "party": "Die Linke",
      "color": {},
      "isPrevious": true,
      "status": "elected",
      "votes": 130000
    }
  ]
}