{
  "title": "FIXTURE: empty candidate names",
  "sources": [
    {
      "text": "NZZ",
      "link": {
        "url": "https://nzz.ch",
        "isValid": true
      }
    }
  ],
  "subtitle":
    "Möglichkeit zusätzliche Informationen als Untertitel zu erfassen",
  "notes":
    "Jemand musste Josef K. verleumdet haben, denn ohne dass er etwas Böses getan hätte, wurde er eines 'Morgens verhaftet.",
  "majority": 100000,
  "candidates": [
    {
      "color": {
        "full": {}
      },
      "isPrevious": true,
      "votes": 50000
    },
    {
      "name": "Maria Müller",
      "party": "SPD",
      "color": {
        "full": {}
      },
      "isPrevious": false,
      "votes": 50000
    },
    {
      "name": "Abdalá Bucaram",
      "party": "Fuerza Compromiso Social Social",
      "color": {
        "full": {}
      },
      "picture": {
        "key": "2018/02/09/81402b8b-49af-4329-afe4-222402f696cf.png",
        "url":
          "https://nzz-q-assets-stage.s3.eu-west-1.amazonaws.com/2018/02/09/81402b8b-49af-4329-afe4-222402f696cf.png",
        "length": 5239,
        "width": 88,
        "height": 88
      },
      "isPrevious": false,
      "votes": 50000
    },
    {
      "name": "",
      "party": "Die Linke",
      "color": {
        "full": {},
        "light": {}
      },
      "picture": {
        "key": "2018/02/09/17cde314-b609-43df-a811-ca2828f3d545.png",
        "url":
          "https://nzz-q-assets-stage.s3.eu-west-1.amazonaws.com/2018/02/09/17cde314-b609-43df-a811-ca2828f3d545.png",
        "length": 4615,
        "width": 88,
        "height": 88
      },
      "isPrevious": true,
      "votes": 50000
    }
  ]
}
